[
  {
    "requirementId": "G6-A-01",
    "grade": 6,
    "topicId": "G6-A",
    "subTopic": "Thông tin và dữ liệu",
    "officialText": "Phân biệt được thông tin với vật mang tin.",
    "studentFriendlyText": "Em phân biệt được thông tin (nội dung mang lại hiểu biết) với vật mang tin (phương tiện lưu giữ thông tin đó).",
    "officialTextHash": "bc33e0175b604c946622ef3f4082ad46426b029fc2ed270750b3a62d51f6ce69",
    "officialSourceId": "SRC-GDPT-2018-TIN6",
    "cognitiveLevel": "nhan_biet",
    "competencyIds": [
      "NLa"
    ],
    "evidenceTypes": [
      "quiz_response",
      "short_answer"
    ],
    "lessonIds": [
      "G6-L01"
    ],
    "nlsMappings": [],
    "aiCompetencyMappings": [],
    "supplementaryKnowledge": null,
    "reviewStatus": "approved_official",
    "status": "published",
    "version": "2018.4"
  },
  {
    "requirementId": "G6-A-02",
    "grade": 6,
    "topicId": "G6-A",
    "subTopic": "Thông tin và dữ liệu",
    "officialText": "Nhận biết được sự khác nhau giữa thông tin và dữ liệu.",
    "studentFriendlyText": "Em nhận biết được điểm khác nhau giữa dữ liệu (chữ, số, hình ảnh, âm thanh) và thông tin rút ra từ dữ liệu đó.",
    "officialTextHash": "026d489984508507c32e97140d3679f951be4a50c513c4d2565d1c14041100ed",
    "officialSourceId": "SRC-GDPT-2018-TIN6",
    "cognitiveLevel": "thong_hieu",
    "competencyIds": [
      "NLa"
    ],
    "evidenceTypes": [
      "quiz_response",
      "short_answer"
    ],
    "lessonIds": [
      "G6-L01"
    ],
    "nlsMappings": [],
    "aiCompetencyMappings": [],
    "supplementaryKnowledge": null,
    "reviewStatus": "approved_official",
    "status": "published",
    "version": "2018.4"
  },
  {
    "requirementId": "G6-A-03",
    "grade": 6,
    "topicId": "G6-A",
    "subTopic": "Thông tin và dữ liệu",
    "officialText": "Nêu được ví dụ minh hoạ mối quan hệ giữa thông tin và dữ liệu.",
    "studentFriendlyText": "Em lấy được ví dụ thực tế cho thấy dữ liệu biểu diễn thông tin và từ dữ liệu ta thu nhận được thông tin.",
    "officialTextHash": "64fc60d72dd2eba48440b8a89a4c29b3567ee0bead5d6713b4387e27bce6b839",
    "officialSourceId": "SRC-GDPT-2018-TIN6",
    "cognitiveLevel": "thong_hieu",
    "competencyIds": [
      "NLa"
    ],
    "evidenceTypes": [
      "short_answer",
      "worksheet_table"
    ],
    "lessonIds": [
      "G6-L01"
    ],
    "nlsMappings": [],
    "aiCompetencyMappings": [],
    "supplementaryKnowledge": null,
    "reviewStatus": "approved_official",
    "status": "published",
    "version": "2018.4"
  },
  {
    "requirementId": "G6-A-04",
    "grade": 6,
    "topicId": "G6-A",
    "subTopic": "Thông tin và dữ liệu",
    "officialText": "Nêu được ví dụ minh hoạ tầm quan trọng của thông tin.",
    "studentFriendlyText": "Em nêu được ví dụ cho thấy thông tin đúng và kịp thời giúp con người đưa ra quyết định hợp lí.",
    "officialTextHash": "73e78b5d1d6dafdd4a1e2ec4da266bf58aa2c28a2024b5ab1acf951c22a3cb8d",
    "officialSourceId": "SRC-GDPT-2018-TIN6",
    "cognitiveLevel": "thong_hieu",
    "competencyIds": [
      "NLa"
    ],
    "evidenceTypes": [
      "short_answer",
      "exit_ticket_reflection"
    ],
    "lessonIds": [
      "G6-L01"
    ],
    "nlsMappings": [],
    "aiCompetencyMappings": [],
    "supplementaryKnowledge": null,
    "reviewStatus": "approved_official",
    "status": "published",
    "version": "2018.4"
  },
  {
    "requirementId": "G6-A-05",
    "grade": 6,
    "topicId": "G6-A",
    "subTopic": "Xử lí thông tin",
    "officialText": "Giải thích được máy tính là công cụ hiệu quả để thu thập, lưu trữ, xử lí và truyền thông tin. Nêu được ví dụ minh hoạ cụ thể.",
    "studentFriendlyText": "Em giải thích được vì sao máy tính giúp thu thập, lưu trữ, xử lí, truyền thông tin nhanh và chính xác, kèm theo ví dụ minh hoạ.",
    "officialTextHash": "40b2f46a2f0c2f540789c353e8bee8d7d4622f9fbcf1dd7008cadb8deb9619e4",
    "officialSourceId": "SRC-GDPT-2018-TIN6",
    "cognitiveLevel": "thong_hieu",
    "competencyIds": [
      "NLa",
      "NLc"
    ],
    "evidenceTypes": [
      "short_answer",
      "exit_ticket_reflection"
    ],
    "lessonIds": [
      "G6-L02"
    ],
    "nlsMappings": [],
    "aiCompetencyMappings": [],
    "supplementaryKnowledge": null,
    "reviewStatus": "approved_official",
    "status": "published",
    "version": "2018.4"
  },
  {
    "requirementId": "G6-A-06",
    "grade": 6,
    "topicId": "G6-A",
    "subTopic": "Xử lí thông tin",
    "officialText": "Nêu được các bước cơ bản trong xử lí thông tin.",
    "studentFriendlyText": "Em kể được các bước cơ bản của quá trình xử lí thông tin: thu nhận, lưu trữ, xử lí và truyền thông tin.",
    "officialTextHash": "161b8b7a392f9a7f6ebbf6daced5fc2ece1873550d7b6abec5e9fd13f6b86060",
    "officialSourceId": "SRC-GDPT-2018-TIN6",
    "cognitiveLevel": "nhan_biet",
    "competencyIds": [
      "NLa",
      "NLc"
    ],
    "evidenceTypes": [
      "quiz_response",
      "short_answer"
    ],
    "lessonIds": [
      "G6-L02"
    ],
    "nlsMappings": [],
    "aiCompetencyMappings": [],
    "supplementaryKnowledge": null,
    "reviewStatus": "approved_official",
    "status": "published",
    "version": "2018.4"
  },
  {
    "requirementId": "G6-A-07",
    "grade": 6,
    "topicId": "G6-A",
    "subTopic": "Biểu diễn thông tin và lưu trữ dữ liệu trong máy tính",
    "officialText": "Giải thích được có thể biểu diễn thông tin chỉ với hai kí hiệu 0 và 1.",
    "studentFriendlyText": "Em giải thích được cách máy tính dùng các dãy gồm hai kí hiệu 0 và 1 để biểu diễn chữ viết, con số, hình ảnh và âm thanh.",
    "officialTextHash": "5562d141c6cce1b1f0e05c416ef985669ec334e11f411f8cf2416ceb6749fa2e",
    "officialSourceId": "SRC-GDPT-2018-TIN6",
    "cognitiveLevel": "thong_hieu",
    "competencyIds": [
      "NLa",
      "NLc"
    ],
    "evidenceTypes": [
      "quiz_response",
      "short_answer"
    ],
    "lessonIds": [
      "G6-L03"
    ],
    "nlsMappings": [],
    "aiCompetencyMappings": [],
    "supplementaryKnowledge": null,
    "reviewStatus": "approved_official",
    "status": "published",
    "version": "2018.4"
  },
  {
    "requirementId": "G6-A-08",
    "grade": 6,
    "topicId": "G6-A",
    "subTopic": "Biểu diễn thông tin và lưu trữ dữ liệu trong máy tính",
    "officialText": "Biết được bit là đơn vị nhỏ nhất trong lưu trữ thông tin.",
    "studentFriendlyText": "Em biết bit là đơn vị nhỏ nhất dùng để lưu thông tin trong máy tính.",
    "officialTextHash": "4c8da387f2adcd984a046e20477db75c7f03f319037e7496b81281d3034dd0a2",
    "officialSourceId": "SRC-GDPT-2018-TIN6",
    "cognitiveLevel": "nhan_biet",
    "competencyIds": [
      "NLa"
    ],
    "evidenceTypes": [
      "quiz_response"
    ],
    "lessonIds": [
      "G6-L03"
    ],
    "nlsMappings": [],
    "aiCompetencyMappings": [],
    "supplementaryKnowledge": null,
    "reviewStatus": "approved_official",
    "status": "published",
    "version": "2018.4"
  },
  {
    "requirementId": "G6-A-09",
    "grade": 6,
    "topicId": "G6-A",
    "subTopic": "Biểu diễn thông tin và lưu trữ dữ liệu trong máy tính",
    "officialText": "Nêu được tên và độ lớn (xấp xỉ theo hệ thập phân) của các đơn vị cơ bản đo dung lượng thông tin: Byte, KB, MB, GB, quy đổi được một cách gần đúng giữa các đơn vị đo lường này. Ví dụ: 1 KB bằng xấp xỉ 1 ngàn byte, 1 MB xấp xỉ 1 triệu byte, 1 GB xấp xỉ 1 tỉ byte.",
    "studentFriendlyText": "Em nêu được tên, độ lớn xấp xỉ của các đơn vị cơ bản Byte, KB, MB, GB và quy đổi gần đúng giữa chúng (1 KB ≈ 1 ngàn byte, 1 MB ≈ 1 triệu byte, 1 GB ≈ 1 tỉ byte).",
    "officialTextHash": "c84e26781190342c0f5dc39a25ec2518866b9e2e059104e9e9ba12d58fd15971",
    "officialSourceId": "SRC-GDPT-2018-TIN6",
    "cognitiveLevel": "van_dung",
    "competencyIds": [
      "NLa",
      "NLc"
    ],
    "evidenceTypes": [
      "quiz_response",
      "worksheet_table"
    ],
    "lessonIds": [
      "G6-L03"
    ],
    "nlsMappings": [
      "NLS-MAP-G6-L03-01",
      "NLS-MAP-G6-L03-02",
      "NLS-MAP-G6-L03-03"
    ],
    "aiCompetencyMappings": [],
    "supplementaryKnowledge": "Mở rộng theo SGK Kết nối tri thức Bài 3: giới thiệu thêm đơn vị Terabyte (1 TB xấp xỉ 1000 GB) khi tìm hiểu ổ cứng dung lượng lớn.",
    "reviewStatus": "approved_official",
    "status": "published",
    "version": "2018.4"
  },
  {
    "requirementId": "G6-A-10",
    "grade": 6,
    "topicId": "G6-A",
    "subTopic": "Biểu diễn thông tin và lưu trữ dữ liệu trong máy tính",
    "officialText": "Nêu được sơ lược khả năng lưu trữ của các thiết bị nhớ thông dụng như đĩa cứng, USB, CD, thẻ nhớ,...",
    "studentFriendlyText": "Em ước lượng và so sánh được khả năng lưu trữ của đĩa cứng, USB, đĩa CD, thẻ nhớ để chọn thiết bị phù hợp.",
    "officialTextHash": "2bf6f34bfa01f42f7c27aed0f023ebcc642a528a82936e4fd18c842c38314a9d",
    "officialSourceId": "SRC-GDPT-2018-TIN6",
    "cognitiveLevel": "thong_hieu",
    "competencyIds": [
      "NLa"
    ],
    "evidenceTypes": [
      "quiz_response",
      "exit_ticket_reflection"
    ],
    "lessonIds": [
      "G6-L03"
    ],
    "nlsMappings": [
      "NLS-MAP-G6-L03-01",
      "NLS-MAP-G6-L03-02",
      "NLS-MAP-G6-L03-03"
    ],
    "aiCompetencyMappings": [],
    "supplementaryKnowledge": null,
    "reviewStatus": "approved_official",
    "status": "published",
    "version": "2018.4"
  },
  {
    "requirementId": "G6-B-01",
    "grade": 6,
    "topicId": "G6-B",
    "subTopic": "Khái niệm và lợi ích của mạng máy tính",
    "officialText": "Nêu được khái niệm và lợi ích của mạng máy tính.",
    "studentFriendlyText": "Em nêu được mạng máy tính là gì và những lợi ích khi kết nối các máy tính với nhau.",
    "officialTextHash": "ca6880fc8686596fb1ddb87019aa8261270eb147d91c3754f7a783e0b153001f",
    "officialSourceId": "SRC-GDPT-2018-TIN6",
    "cognitiveLevel": "nhan_biet",
    "competencyIds": [
      "NLa",
      "NLe"
    ],
    "evidenceTypes": [
      "quiz_response",
      "short_answer"
    ],
    "lessonIds": [
      "G6-L04"